revs,Preprocessed_Text,Sentiment_Scores
"I recently had the pleasure of working with Jamie, and I have to say that I was thoroughly impressed by his professionalism and expertise.Jamie took the time to break down my account and explain everything to me in a clear and concise manner. He was patient, knowledgeable, and went above and beyond to ensure that I fully understood everything about my account.Not only was Jamie able to explain the technical aspects of my account, but he was also able to provide valuable insights and recommendations based on my usage patterns. He was able to identify areas where I could save money and improve my overall experience with Vodafone.I appreciated Jamie's attention to detail and his willingness to answer all of my questions. He was polite, courteous, and made the entire process seamless and stress-free.Overall, I would highly recommend Jamie to anyone in need of a sales consultant at the Vodafone store. His expertise and customer service skills are truly exceptional, and I feel confident that anyone who works with him will be more than satisfied with the experience. Thank you, Jamie, for all of your help!","['i', 'recently', 'had', 'the', 'pleasure', 'of', 'working', 'with', 'jamie', ',', 'and', 'i', 'have', 'to', 'say', 'that', 'i', 'was', 'thoroughly', 'impressed', 'by', 'his', 'professionalism', 'and', 'expertise.jamie', 'took', 'the', 'time', 'to', 'break', 'down', 'my', 'account', 'and', 'explain', 'everything', 'to', 'me', 'in', 'a', 'clear', 'and', 'concise', 'manner', '.', 'he', 'was', 'patient', ',', 'knowledgeable', ',', 'and', 'went', 'above', 'and', 'beyond', 'to', 'ensure', 'that', 'i', 'fully', 'understood', 'everything', 'about', 'my', 'account.not', 'only', 'was', 'jamie', 'able', 'to', 'explain', 'the', 'technical', 'aspects', 'of', 'my', 'account', ',', 'but', 'he', 'was', 'also', 'able', 'to', 'provide', 'valuable', 'insights', 'and', 'recommendations', 'based', 'on', 'my', 'usage', 'patterns', '.', 'he', 'was', 'able', 'to', 'identify', 'areas', 'where', 'i', 'could', 'save', 'money', 'and', 'improve', 'my', 'overall', 'experience', 'with', 'vodafone.i', 'appreciated', 'jamie', ""'s"", 'attention', 'to', 'detail', 'and', 'his', 'willingness', 'to', 'answer', 'all', 'of', 'my', 'questions', '.', 'he', 'was', 'polite', ',', 'courteous', ',', 'and', 'made', 'the', 'entire', 'process', 'seamless', 'and', 'stress-free.overall', ',', 'i', 'would', 'highly', 'recommend', 'jamie', 'to', 'anyone', 'in', 'need', 'of', 'a', 'sales', 'consultant', 'at', 'the', 'vodafone', 'store', '.', 'his', 'expertise', 'and', 'customer', 'service', 'skills', 'are', 'truly', 'exceptional', ',', 'and', 'i', 'feel', 'confident', 'that', 'anyone', 'who', 'works', 'with', 'him', 'will', 'be', 'more', 'than', 'satisfied', 'with', 'the', 'experience', '.', 'thank', 'you', ',', 'jamie', ',', 'for', 'all', 'of', 'your', 'help', '!']","{'neg': 0.0, 'neu': 0.746, 'pos': 0.254, 'compound': 0.9951}"
Subrata helped me with issues I had on my new phone. Happy with the service in store.,"['subrata', 'helped', 'me', 'with', 'issues', 'i', 'had', 'on', 'my', 'new', 'phone', '.', 'happy', 'with', 'the', 'service', 'in', 'store', '.']","{'neg': 0.0, 'neu': 0.802, 'pos': 0.198, 'compound': 0.5719}"
"Vodafone locked me into a 2-year contract which they will not let me leave. However, they have increased the price of the CONTRACT numerous times, which was not the price I signed up for. In the last 18 months they have increased my CONTRACT price by almost 50%!!!! Yet, they won't let me leave unless I pay them the full outstanding contract amount, which doesn't make sense as I'd be giving them my money for no service provided. They also won't offer to lower my bill on par with what they are offering new customers (if you're considering taking their offer, don't join them!!!!! Or you'll fall victim to the same scam as me). I'm now paying outrageous £18.75 per month for a meager 5GB data plan (!!!!!), whereas ANYWHERE ELSE this plan would be around £5 - and Vodafone pretends that they have to UP MY PRICE mid-contract by 14.5% just now, from £16.39 (which was my current price after 2x price increases already) to £18.75!! I am so disgusted it's beyond belief. Energy companies and mortgage providers can't up your price mid-contract, so why are these thiefing telephone companies allowed to??? I will not be giving them my money for no service, but I swear I will shout from the rooftops to warn people not to sign up for a contract with these cheating robbing b******* and I will never ever give them any of my money. DO NOT USE THEM!!!","['vodafone', 'locked', 'me', 'into', 'a', '2-year', 'contract', 'which', 'they', 'will', 'not', 'let', 'me', 'leave', '.', 'however', ',', 'they', 'have', 'increased', 'the', 'price', 'of', 'the', 'contract', 'numerous', 'times', ',', 'which', 'was', 'not', 'the', 'price', 'i', 'signed', 'up', 'for', '.', 'in', 'the', 'last', '18', 'months', 'they', 'have', 'increased', 'my', 'contract', 'price', 'by', 'almost', '50', '%', '!', '!', '!', '!', 'yet', ',', 'they', 'wo', ""n't"", 'let', 'me', 'leave', 'unless', 'i', 'pay', 'them', 'the', 'full', 'outstanding', 'contract', 'amount', ',', 'which', 'does', ""n't"", 'make', 'sense', 'as', 'i', ""'d"", 'be', 'giving', 'them', 'my', 'money', 'for', 'no', 'service', 'provided', '.', 'they', 'also', 'wo', ""n't"", 'offer', 'to', 'lower', 'my', 'bill', 'on', 'par', 'with', 'what', 'they', 'are', 'offering', 'new', 'customers', '(', 'if', 'you', ""'re"", 'considering', 'taking', 'their', 'offer', ',', 'do', ""n't"", 'join', 'them', '!', '!', '!', '!', '!', 'or', 'you', ""'ll"", 'fall', 'victim', 'to', 'the', 'same', 'scam', 'as', 'me', ')', '.', 'i', ""'m"", 'now', 'paying', 'outrageous', '£18.75', 'per', 'month', 'for', 'a', 'meager', '5gb', 'data', 'plan', '(', '!', '!', '!', '!', '!', ')', ',', 'whereas', 'anywhere', 'else', 'this', 'plan', 'would', 'be', 'around', '£5', '-', 'and', 'vodafone', 'pretends', 'that', 'they', 'have', 'to', 'up', 'my', 'price', 'mid-contract', 'by', '14.5', '%', 'just', 'now', ',', 'from', '£16.39', '(', 'which', 'was', 'my', 'current', 'price', 'after', '2x', 'price', 'increases', 'already', ')', 'to', '£18.75', '!', '!', 'i', 'am', 'so', 'disgusted', 'it', ""'s"", 'beyond', 'belief', '.', 'energy', 'companies', 'and', 'mortgage', 'providers', 'ca', ""n't"", 'up', 'your', 'price', 'mid-contract', ',', 'so', 'why', 'are', 'these', 'thiefing', 'telephone', 'companies', 'allowed', 'to', '?', '?', '?', 'i', 'will', 'not', 'be', 'giving', 'them', 'my', 'money', 'for', 'no', 'service', ',', 'but', 'i', 'swear', 'i', 'will', 'shout', 'from', 'the', 'rooftops', 'to', 'warn', 'people', 'not', 'to', 'sign', 'up', 'for', 'a', 'contract', 'with', 'these', 'cheating', 'robbing', 'b', '*', '*', '*', '*', '*', '*', '*', 'and', 'i', 'will', 'never', 'ever', 'give', 'them', 'any', 'of', 'my', 'money', '.', 'do', 'not', 'use', 'them', '!', '!', '!']","{'neg': 0.098, 'neu': 0.847, 'pos': 0.055, 'compound': -0.8999}"
Amazing customer service. Everyone was so polite and easy to deal with,"['amazing', 'customer', 'service', '.', 'everyone', 'was', 'so', 'polite', 'and', 'easy', 'to', 'deal', 'with']","{'neg': 0.0, 'neu': 0.589, 'pos': 0.411, 'compound': 0.7884}"
Siobhan was really helpful when I was choosing my new phone in store. I had no idea what to get but she was knowledgeable and friendly throughout & made my decision easy!! Thank you again! I will be back when this contract runs out too 😊,"['siobhan', 'was', 'really', 'helpful', 'when', 'i', 'was', 'choosing', 'my', 'new', 'phone', 'in', 'store', '.', 'i', 'had', 'no', 'idea', 'what', 'to', 'get', 'but', 'she', 'was', 'knowledgeable', 'and', 'friendly', 'throughout', '&', 'made', 'my', 'decision', 'easy', '!', '!', 'thank', 'you', 'again', '!', 'i', 'will', 'be', 'back', 'when', 'this', 'contract', 'runs', 'out', 'too', '😊']","{'neg': 0.031, 'neu': 0.693, 'pos': 0.276, 'compound': 0.929}"
Great service! Would definitely recommend!,"['great', 'service', '!', 'would', 'definitely', 'recommend', '!']","{'neg': 0.0, 'neu': 0.168, 'pos': 0.832, 'compound': 0.8715}"
Spoke to the adviser Kaiser in the Reading Oracle Vodafone store who was so extemefully polite and really helpful in helping me understanding my contract. Will definitely be back to see him in person in the near future for my contract renewal. Thanks for help!,"['spoke', 'to', 'the', 'adviser', 'kaiser', 'in', 'the', 'reading', 'oracle', 'vodafone', 'store', 'who', 'was', 'so', 'extemefully', 'polite', 'and', 'really', 'helpful', 'in', 'helping', 'me', 'understanding', 'my', 'contract', '.', 'will', 'definitely', 'be', 'back', 'to', 'see', 'him', 'in', 'person', 'in', 'the', 'near', 'future', 'for', 'my', 'contract', 'renewal', '.', 'thanks', 'for', 'help', '!']","{'neg': 0.0, 'neu': 0.739, 'pos': 0.261, 'compound': 0.9209}"
"The worst company I've ever had the misfortune of dealing with. Internet was Installed on 28/03/23 and didn't work, had to call them up multiple times and deal with unhelpful advisors and needless to say, three weeks later I still have no internet.I've finally given up and decided to leave and they're not only telling me that I won't be entitled to any compensation for the three weeks that I've been left without internet and the poor service I've received but that I will have to pay a fee to leave. Absolute joke of a company.","['the', 'worst', 'company', 'i', ""'ve"", 'ever', 'had', 'the', 'misfortune', 'of', 'dealing', 'with', '.', 'internet', 'was', 'installed', 'on', '28/03/23', 'and', 'did', ""n't"", 'work', ',', 'had', 'to', 'call', 'them', 'up', 'multiple', 'times', 'and', 'deal', 'with', 'unhelpful', 'advisors', 'and', 'needless', 'to', 'say', ',', 'three', 'weeks', 'later', 'i', 'still', 'have', 'no', 'internet.i', ""'ve"", 'finally', 'given', 'up', 'and', 'decided', 'to', 'leave', 'and', 'they', ""'re"", 'not', 'only', 'telling', 'me', 'that', 'i', 'wo', ""n't"", 'be', 'entitled', 'to', 'any', 'compensation', 'for', 'the', 'three', 'weeks', 'that', 'i', ""'ve"", 'been', 'left', 'without', 'internet', 'and', 'the', 'poor', 'service', 'i', ""'ve"", 'received', 'but', 'that', 'i', 'will', 'have', 'to', 'pay', 'a', 'fee', 'to', 'leave', '.', 'absolute', 'joke', 'of', 'a', 'company', '.']","{'neg': 0.114, 'neu': 0.858, 'pos': 0.028, 'compound': -0.5868}"
"Thank you waseem at Vodafone LLandudno. For helping me and sorting everything out for me . Waseem is very informative and knowledgeable. If in the future I need help , I’d definitely be going back to LLandudno Vodafone for any help. Thanks to all the staff there . 🫡","['thank', 'you', 'waseem', 'at', 'vodafone', 'llandudno', '.', 'for', 'helping', 'me', 'and', 'sorting', 'everything', 'out', 'for', 'me', '.', 'waseem', 'is', 'very', 'informative', 'and', 'knowledgeable', '.', 'if', 'in', 'the', 'future', 'i', 'need', 'help', ',', 'i', '’', 'd', 'definitely', 'be', 'going', 'back', 'to', 'llandudno', 'vodafone', 'for', 'any', 'help', '.', 'thanks', 'to', 'all', 'the', 'staff', 'there', '.', '\U0001fae1']","{'neg': 0.0, 'neu': 0.702, 'pos': 0.298, 'compound': 0.9287}"
"I have been with Vodafone broadband since 2020. Initially it was sold as £22 per month which I thought was quite good. But it has continued to rise year after year to £33. I thought this latest increase was taking the mick so I discussed with live chat. Apparently my contract states they can increase my contract every April by 13.8 percent. I would have never agreed to that so they have either conned me into a ridiculous contract by adding that in small print somewhere? Or they have just added it in. I read contracts very carefully so I assume the later. Didn’t even try and help me change contracts or try to lower the bill. Avoid at all costs this company as they are nothing but thieves. 🤬Update- I received an email due to the one star from a so called senior management to arrange best time to call to discuss. Guess what they haven’t bothered? Too late now I’ve just changed to Zen broadband, I will tell everyone to avoid these jokers like the plague. Don’t you dare even try to take anymore money off me when I go.","['i', 'have', 'been', 'with', 'vodafone', 'broadband', 'since', '2020.', 'initially', 'it', 'was', 'sold', 'as', '£22', 'per', 'month', 'which', 'i', 'thought', 'was', 'quite', 'good', '.', 'but', 'it', 'has', 'continued', 'to', 'rise', 'year', 'after', 'year', 'to', '£33', '.', 'i', 'thought', 'this', 'latest', 'increase', 'was', 'taking', 'the', 'mick', 'so', 'i', 'discussed', 'with', 'live', 'chat', '.', 'apparently', 'my', 'contract', 'states', 'they', 'can', 'increase', 'my', 'contract', 'every', 'april', 'by', '13.8', 'percent', '.', 'i', 'would', 'have', 'never', 'agreed', 'to', 'that', 'so', 'they', 'have', 'either', 'conned', 'me', 'into', 'a', 'ridiculous', 'contract', 'by', 'adding', 'that', 'in', 'small', 'print', 'somewhere', '?', 'or', 'they', 'have', 'just', 'added', 'it', 'in', '.', 'i', 'read', 'contracts', 'very', 'carefully', 'so', 'i', 'assume', 'the', 'later', '.', 'didn', '’', 't', 'even', 'try', 'and', 'help', 'me', 'change', 'contracts', 'or', 'try', 'to', 'lower', 'the', 'bill', '.', 'avoid', 'at', 'all', 'costs', 'this', 'company', 'as', 'they', 'are', 'nothing', 'but', 'thieves', '.', '🤬update-', 'i', 'received', 'an', 'email', 'due', 'to', 'the', 'one', 'star', 'from', 'a', 'so', 'called', 'senior', 'management', 'to', 'arrange', 'best', 'time', 'to', 'call', 'to', 'discuss', '.', 'guess', 'what', 'they', 'haven', '’', 't', 'bothered', '?', 'too', 'late', 'now', 'i', '’', 've', 'just', 'changed', 'to', 'zen', 'broadband', ',', 'i', 'will', 'tell', 'everyone', 'to', 'avoid', 'these', 'jokers', 'like', 'the', 'plague', '.', 'don', '’', 't', 'you', 'dare', 'even', 'try', 'to', 'take', 'anymore', 'money', 'off', 'me', 'when', 'i', 'go', '.']","{'neg': 0.08, 'neu': 0.792, 'pos': 0.127, 'compound': 0.8974}"
"Steve and his  team in the Poole store were incredibly helpful at sorting out a replacement sim quickly for me, friendly and professional.","['steve', 'and', 'his', 'team', 'in', 'the', 'poole', 'store', 'were', 'incredibly', 'helpful', 'at', 'sorting', 'out', 'a', 'replacement', 'sim', 'quickly', 'for', 'me', ',', 'friendly', 'and', 'professional', '.']","{'neg': 0.0, 'neu': 0.761, 'pos': 0.239, 'compound': 0.7425}"
"Went into kendal store to upgrade as the Vodafone app was not that easy for a non-tech. I was super impressed with Staff member who gave me a lot of his time and seemed knowledgeable in his field. I opted for trade in.  I left both phones for all data to be transferred.  All seemed ok and i had no reason to doubt there was anything amiss.   I left the store very happy with the service i received. HOWEVER I arrived home and nothing would work - no txts, no signal, not able to download some apps!   When we tried to phone my number - went straight to v/mail. Eventually i realised i had NO SIM in the new phone as it had been left in my old phone which we traded in. The very week I needed to have a phone and be contactable I had no phone. I had to then go on Vodafone chat to order a new SIM card and have to do all the effort of keeping my own number!    Couldn’t have happened at a worse time. Couldn’t get back to store for a few days due to working Shop had closed before I realised. Shop was busy and only 2 staff members. Could have been because of the staff being stretched but really problematic for me.","['went', 'into', 'kendal', 'store', 'to', 'upgrade', 'as', 'the', 'vodafone', 'app', 'was', 'not', 'that', 'easy', 'for', 'a', 'non-tech', '.', 'i', 'was', 'super', 'impressed', 'with', 'staff', 'member', 'who', 'gave', 'me', 'a', 'lot', 'of', 'his', 'time', 'and', 'seemed', 'knowledgeable', 'in', 'his', 'field', '.', 'i', 'opted', 'for', 'trade', 'in', '.', 'i', 'left', 'both', 'phones', 'for', 'all', 'data', 'to', 'be', 'transferred', '.', 'all', 'seemed', 'ok', 'and', 'i', 'had', 'no', 'reason', 'to', 'doubt', 'there', 'was', 'anything', 'amiss', '.', 'i', 'left', 'the', 'store', 'very', 'happy', 'with', 'the', 'service', 'i', 'received', '.', 'however', 'i', 'arrived', 'home', 'and', 'nothing', 'would', 'work', '-', 'no', 'txts', ',', 'no', 'signal', ',', 'not', 'able', 'to', 'download', 'some', 'apps', '!', 'when', 'we', 'tried', 'to', 'phone', 'my', 'number', '-', 'went', 'straight', 'to', 'v/mail', '.', 'eventually', 'i', 'realised', 'i', 'had', 'no', 'sim', 'in', 'the', 'new', 'phone', 'as', 'it', 'had', 'been', 'left', 'in', 'my', 'old', 'phone', 'which', 'we', 'traded', 'in', '.', 'the', 'very', 'week', 'i', 'needed', 'to', 'have', 'a', 'phone', 'and', 'be', 'contactable', 'i', 'had', 'no', 'phone', '.', 'i', 'had', 'to', 'then', 'go', 'on', 'vodafone', 'chat', 'to', 'order', 'a', 'new', 'sim', 'card', 'and', 'have', 'to', 'do', 'all', 'the', 'effort', 'of', 'keeping', 'my', 'own', 'number', '!', 'couldn', '’', 't', 'have', 'happened', 'at', 'a', 'worse', 'time', '.', 'couldn', '’', 't', 'get', 'back', 'to', 'store', 'for', 'a', 'few', 'days', 'due', 'to', 'working', 'shop', 'had', 'closed', 'before', 'i', 'realised', '.', 'shop', 'was', 'busy', 'and', 'only', '2', 'staff', 'members', '.', 'could', 'have', 'been', 'because', 'of', 'the', 'staff', 'being', 'stretched', 'but', 'really', 'problematic', 'for', 'me', '.']","{'neg': 0.086, 'neu': 0.857, 'pos': 0.057, 'compound': -0.721}"
"Incredibly friendly and helpful, Abi, a team member, was very helpful and a pleasure to speak to. I would recommend the store and will definitely be returning in the future.","['incredibly', 'friendly', 'and', 'helpful', ',', 'abi', ',', 'a', 'team', 'member', ',', 'was', 'very', 'helpful', 'and', 'a', 'pleasure', 'to', 'speak', 'to', '.', 'i', 'would', 'recommend', 'the', 'store', 'and', 'will', 'definitely', 'be', 'returning', 'in', 'the', 'future', '.']","{'neg': 0.0, 'neu': 0.528, 'pos': 0.472, 'compound': 0.957}"
"Customer service is absolutely appalling. Either they don’t answer the phone or they leave you waiting for up to an hour on web chat before responding and then when you do get through to someone, you have to type some form of response every 2 minutes to “not lose the chat”. EVERY TIME I try to talk to someone about an issue, this message appears - “There’s a problem connecting with an advisor. Please wait while your chat is transferred to another advisor!”Last week, one person told me they had resolved my plan issue but a week later it is still not resolved and again today, no one will help or rectify the problem!Never again will I use Vodafone’s service!","['customer', 'service', 'is', 'absolutely', 'appalling', '.', 'either', 'they', 'don', '’', 't', 'answer', 'the', 'phone', 'or', 'they', 'leave', 'you', 'waiting', 'for', 'up', 'to', 'an', 'hour', 'on', 'web', 'chat', 'before', 'responding', 'and', 'then', 'when', 'you', 'do', 'get', 'through', 'to', 'someone', ',', 'you', 'have', 'to', 'type', 'some', 'form', 'of', 'response', 'every', '2', 'minutes', 'to', '“', 'not', 'lose', 'the', 'chat', '”', '.', 'every', 'time', 'i', 'try', 'to', 'talk', 'to', 'someone', 'about', 'an', 'issue', ',', 'this', 'message', 'appears', '-', '“', 'there', '’', 's', 'a', 'problem', 'connecting', 'with', 'an', 'advisor', '.', 'please', 'wait', 'while', 'your', 'chat', 'is', 'transferred', 'to', 'another', 'advisor', '!', '”', 'last', 'week', ',', 'one', 'person', 'told', 'me', 'they', 'had', 'resolved', 'my', 'plan', 'issue', 'but', 'a', 'week', 'later', 'it', 'is', 'still', 'not', 'resolved', 'and', 'again', 'today', ',', 'no', 'one', 'will', 'help', 'or', 'rectify', 'the', 'problem', '!', 'never', 'again', 'will', 'i', 'use', 'vodafone', '’', 's', 'service', '!']","{'neg': 0.094, 'neu': 0.826, 'pos': 0.08, 'compound': -0.4298}"
"Great service, really informative and help me with everything I needed.","['great', 'service', ',', 'really', 'informative', 'and', 'help', 'me', 'with', 'everything', 'i', 'needed', '.']","{'neg': 0.0, 'neu': 0.531, 'pos': 0.469, 'compound': 0.7943}"
"Such a fu**ing terrible customer service! 🤮😡😤 Totally useless good for nothing. 1 h wasted from my life waited for them to help me... But they don't have any interest to do something for me.Heyyyyyy, employ someone who is capable to know to solve a problem and TEACH them how to speak with people! Shame on you!!! Why do you think the reviews are so bad 🤮🤢... Learn to RESPECT ( if you heard about this word) customers! 🤬😡🤬🤬🤬🤬🤬🤬🤬🤬🤬🤬🤬🤬🤬🤬🤬🤬🤬🤬🤬🤬🤬🤬🤬🤬🤬🤬🤬🤬🤬","['such', 'a', 'fu', '*', '*', 'ing', 'terrible', 'customer', 'service', '!', '🤮😡😤', 'totally', 'useless', 'good', 'for', 'nothing', '.', '1', 'h', 'wasted', 'from', 'my', 'life', 'waited', 'for', 'them', 'to', 'help', 'me', '...', 'but', 'they', 'do', ""n't"", 'have', 'any', 'interest', 'to', 'do', 'something', 'for', 'me.heyyyyyy', ',', 'employ', 'someone', 'who', 'is', 'capable', 'to', 'know', 'to', 'solve', 'a', 'problem', 'and', 'teach', 'them', 'how', 'to', 'speak', 'with', 'people', '!', 'shame', 'on', 'you', '!', '!', '!', 'why', 'do', 'you', 'think', 'the', 'reviews', 'are', 'so', 'bad', '🤮🤢', '...', 'learn', 'to', 'respect', '(', 'if', 'you', 'heard', 'about', 'this', 'word', ')', 'customers', '!', '🤬😡🤬🤬🤬🤬🤬🤬🤬🤬🤬🤬🤬🤬🤬🤬🤬🤬🤬🤬🤬🤬🤬🤬🤬🤬🤬🤬🤬🤬🤬']","{'neg': 0.239, 'neu': 0.615, 'pos': 0.147, 'compound': -0.9147}"
Purchased a new phone from St albans Store. Great experiance. Staff were professional. Nice store very clean and upto date. Top attendants to point out Ahmer and Mutahara - very courteous and knowledgeable - attached a great Sim only deal to suit my needs in the UK and abroad - Highly recommend to see them.,"['purchased', 'a', 'new', 'phone', 'from', 'st', 'albans', 'store', '.', 'great', 'experiance', '.', 'staff', 'were', 'professional', '.', 'nice', 'store', 'very', 'clean', 'and', 'upto', 'date', '.', 'top', 'attendants', 'to', 'point', 'out', 'ahmer', 'and', 'mutahara', '-', 'very', 'courteous', 'and', 'knowledgeable', '-', 'attached', 'a', 'great', 'sim', 'only', 'deal', 'to', 'suit', 'my', 'needs', 'in', 'the', 'uk', 'and', 'abroad', '-', 'highly', 'recommend', 'to', 'see', 'them', '.']","{'neg': 0.0, 'neu': 0.66, 'pos': 0.34, 'compound': 0.969}"
Beth is the greatest 🤩 very attentive and friendly. We will come back again for the purchase. I will bring Caffeine for the win 🤣😂🤣😂,"['beth', 'is', 'the', 'greatest', '🤩', 'very', 'attentive', 'and', 'friendly', '.', 'we', 'will', 'come', 'back', 'again', 'for', 'the', 'purchase', '.', 'i', 'will', 'bring', 'caffeine', 'for', 'the', 'win', '🤣😂🤣😂']","{'neg': 0.0, 'neu': 0.636, 'pos': 0.364, 'compound': 0.9093}"
Broadband seems to be ok been online with Vodafone since December last year very few outages BUT the Vodafone router is absolutely rubbish we had to buy an extender to reach all our house our previous Talktalk router was fine.Edit 17/4/23 No point in me reaching out as you put it you won't do anything about it I have tried all I was told I would have to upgrade which I don't have the money to do,"['broadband', 'seems', 'to', 'be', 'ok', 'been', 'online', 'with', 'vodafone', 'since', 'december', 'last', 'year', 'very', 'few', 'outages', 'but', 'the', 'vodafone', 'router', 'is', 'absolutely', 'rubbish', 'we', 'had', 'to', 'buy', 'an', 'extender', 'to', 'reach', 'all', 'our', 'house', 'our', 'previous', 'talktalk', 'router', 'was', 'fine.edit', '17/4/23', 'no', 'point', 'in', 'me', 'reaching', 'out', 'as', 'you', 'put', 'it', 'you', 'wo', ""n't"", 'do', 'anything', 'about', 'it', 'i', 'have', 'tried', 'all', 'i', 'was', 'told', 'i', 'would', 'have', 'to', 'upgrade', 'which', 'i', 'do', ""n't"", 'have', 'the', 'money', 'to', 'do']","{'neg': 0.036, 'neu': 0.902, 'pos': 0.063, 'compound': 0.0387}"
"Popped in to Vodafone to charge my phone because I couldnt use my Apple Pay :( the lovely gentleman sorted me out and I even got a discount on my broadband whilst I waiting. Happy all round - would definitely recommend, great customer service","['popped', 'in', 'to', 'vodafone', 'to', 'charge', 'my', 'phone', 'because', 'i', 'couldnt', 'use', 'my', 'apple', 'pay', ':', '(', 'the', 'lovely', 'gentleman', 'sorted', 'me', 'out', 'and', 'i', 'even', 'got', 'a', 'discount', 'on', 'my', 'broadband', 'whilst', 'i', 'waiting', '.', 'happy', 'all', 'round', '-', 'would', 'definitely', 'recommend', ',', 'great', 'customer', 'service']","{'neg': 0.028, 'neu': 0.637, 'pos': 0.335, 'compound': 0.9468}"
