revs,Preprocessed_Text,Sentiment_Scores
Excellent service as always. Liam was brilliant and very helpful,"['excellent', 'service', 'as', 'always', '.', 'liam', 'was', 'brilliant', 'and', 'very', 'helpful']","{'neg': 0.0, 'neu': 0.398, 'pos': 0.602, 'compound': 0.8908}"
Josh has been super super helpful. He is an asset to your company. He went above and beyond to help with my charging port. It will be a real shame that he leaves soon! I will make sure to bring him a present!,"['josh', 'has', 'been', 'super', 'super', 'helpful', '.', 'he', 'is', 'an', 'asset', 'to', 'your', 'company', '.', 'he', 'went', 'above', 'and', 'beyond', 'to', 'help', 'with', 'my', 'charging', 'port', '.', 'it', 'will', 'be', 'a', 'real', 'shame', 'that', 'he', 'leaves', 'soon', '!', 'i', 'will', 'make', 'sure', 'to', 'bring', 'him', 'a', 'present', '!']","{'neg': 0.057, 'neu': 0.602, 'pos': 0.341, 'compound': 0.9391}"
Was served by Anjum great service and customer experience,"['was', 'served', 'by', 'anjum', 'great', 'service', 'and', 'customer', 'experience']","{'neg': 0.0, 'neu': 0.661, 'pos': 0.339, 'compound': 0.6249}"
"Very helpful and patient, help set up phone, gave good advice. At the Elgin Vodafone,  everyone smiles.","['very', 'helpful', 'and', 'patient', ',', 'help', 'set', 'up', 'phone', ',', 'gave', 'good', 'advice', '.', 'at', 'the', 'elgin', 'vodafone', ',', 'everyone', 'smiles', '.']","{'neg': 0.0, 'neu': 0.524, 'pos': 0.476, 'compound': 0.8955}"
Had great experience in Vodafone got served by jafar who was amazing incredible his service was just amazing couldn’t have asked for a better sales agent highly recommend going into store and getting upgrade or a new phone instead of over the phone jafar really made my visit the best it could be,"['had', 'great', 'experience', 'in', 'vodafone', 'got', 'served', 'by', 'jafar', 'who', 'was', 'amazing', 'incredible', 'his', 'service', 'was', 'just', 'amazing', 'couldn', '’', 't', 'have', 'asked', 'for', 'a', 'better', 'sales', 'agent', 'highly', 'recommend', 'going', 'into', 'store', 'and', 'getting', 'upgrade', 'or', 'a', 'new', 'phone', 'instead', 'of', 'over', 'the', 'phone', 'jafar', 'really', 'made', 'my', 'visit', 'the', 'best', 'it', 'could', 'be']","{'neg': 0.0, 'neu': 0.676, 'pos': 0.324, 'compound': 0.9705}"
The staff were so helpful and explained everything to me.Nothing was any trouble.,"['the', 'staff', 'were', 'so', 'helpful', 'and', 'explained', 'everything', 'to', 'me.nothing', 'was', 'any', 'trouble', '.']","{'neg': 0.156, 'neu': 0.635, 'pos': 0.209, 'compound': 0.2302}"
"Best service, extremely efficient staff. Providing data transfer as well. Thank you Rado","['best', 'service', ',', 'extremely', 'efficient', 'staff', '.', 'providing', 'data', 'transfer', 'as', 'well', '.', 'thank', 'you', 'rado']","{'neg': 0.0, 'neu': 0.431, 'pos': 0.569, 'compound': 0.8977}"
Mark was very helpful went in to help with something else and he managed to help with my issues as well was very welcoming and friendly,"['mark', 'was', 'very', 'helpful', 'went', 'in', 'to', 'help', 'with', 'something', 'else', 'and', 'he', 'managed', 'to', 'help', 'with', 'my', 'issues', 'as', 'well', 'was', 'very', 'welcoming', 'and', 'friendly']","{'neg': 0.0, 'neu': 0.537, 'pos': 0.463, 'compound': 0.9455}"
"Guilherme from the Lower Marsh store did a superb job and helped in a big way! If you’re looking for a good Vodafone experience, come to this store and speak to Gui!","['guilherme', 'from', 'the', 'lower', 'marsh', 'store', 'did', 'a', 'superb', 'job', 'and', 'helped', 'in', 'a', 'big', 'way', '!', 'if', 'you', '’', 're', 'looking', 'for', 'a', 'good', 'vodafone', 'experience', ',', 'come', 'to', 'this', 'store', 'and', 'speak', 'to', 'gui', '!']","{'neg': 0.06, 'neu': 0.734, 'pos': 0.206, 'compound': 0.7494}"
Fantastic help and support from Sam in Guildford today with setting up my sons first phone and making sure it was safe. An absolute super star who has saved me hours of time and probably many tears as well. Thanks so much,"['fantastic', 'help', 'and', 'support', 'from', 'sam', 'in', 'guildford', 'today', 'with', 'setting', 'up', 'my', 'sons', 'first', 'phone', 'and', 'making', 'sure', 'it', 'was', 'safe', '.', 'an', 'absolute', 'super', 'star', 'who', 'has', 'saved', 'me', 'hours', 'of', 'time', 'and', 'probably', 'many', 'tears', 'as', 'well', '.', 'thanks', 'so', 'much']","{'neg': 0.032, 'neu': 0.535, 'pos': 0.433, 'compound': 0.9719}"
"Brilliant advice, knowledge and help from Kish very happy :]","['brilliant', 'advice', ',', 'knowledge', 'and', 'help', 'from', 'kish', 'very', 'happy', ':', ']']","{'neg': 0.0, 'neu': 0.364, 'pos': 0.636, 'compound': 0.8883}"
"Very knowledgeable customer service agent, pleasant and with no pressure sales tactics","['very', 'knowledgeable', 'customer', 'service', 'agent', ',', 'pleasant', 'and', 'with', 'no', 'pressure', 'sales', 'tactics']","{'neg': 0.263, 'neu': 0.539, 'pos': 0.198, 'compound': -0.0258}"
Amz was so helpful.  Nothing was too much trouble. Spent ages helping two Internet illiterate pensioners with extreme patience. Great service.,"['amz', 'was', 'so', 'helpful', '.', 'nothing', 'was', 'too', 'much', 'trouble', '.', 'spent', 'ages', 'helping', 'two', 'internet', 'illiterate', 'pensioners', 'with', 'extreme', 'patience', '.', 'great', 'service', '.']","{'neg': 0.091, 'neu': 0.574, 'pos': 0.335, 'compound': 0.8029}"
Worst network Worst customer service Price is so higher..hirt internet and customer service Charge you a lot without any real reason,"['worst', 'network', 'worst', 'customer', 'service', 'price', 'is', 'so', 'higher', '..', 'hirt', 'internet', 'and', 'customer', 'service', 'charge', 'you', 'a', 'lot', 'without', 'any', 'real', 'reason']","{'neg': 0.291, 'neu': 0.709, 'pos': 0.0, 'compound': -0.8481}"
Mark was very helpful went through lots of different options and helped choose which was best,"['mark', 'was', 'very', 'helpful', 'went', 'through', 'lots', 'of', 'different', 'options', 'and', 'helped', 'choose', 'which', 'was', 'best']","{'neg': 0.0, 'neu': 0.657, 'pos': 0.343, 'compound': 0.807}"
I received a very warm welcome from customer service. Very professional😊,"['i', 'received', 'a', 'very', 'warm', 'welcome', 'from', 'customer', 'service', '.', 'very', 'professional😊']","{'neg': 0.0, 'neu': 0.561, 'pos': 0.439, 'compound': 0.6674}"
"Mitch,Assad and Tom at the Alton branch were so very helpful with my questions and queries.  Would thoroughly recommend them.","['mitch', ',', 'assad', 'and', 'tom', 'at', 'the', 'alton', 'branch', 'were', 'so', 'very', 'helpful', 'with', 'my', 'questions', 'and', 'queries', '.', 'would', 'thoroughly', 'recommend', 'them', '.']","{'neg': 0.0, 'neu': 0.755, 'pos': 0.245, 'compound': 0.7323}"
Great experience at store team I’d amazing Jon was great,"['great', 'experience', 'at', 'store', 'team', 'i', '’', 'd', 'amazing', 'jon', 'was', 'great']","{'neg': 0.0, 'neu': 0.333, 'pos': 0.667, 'compound': 0.9186}"
Excellent advice from Tyler. Much appreciated,"['excellent', 'advice', 'from', 'tyler', '.', 'much', 'appreciated']","{'neg': 0.0, 'neu': 0.364, 'pos': 0.636, 'compound': 0.7906}"
Ibtihal was very patient and nice. She was also very understanding and met my needs. I do appreciate being served by such people. Well done to her.,"['ibtihal', 'was', 'very', 'patient', 'and', 'nice', '.', 'she', 'was', 'also', 'very', 'understanding', 'and', 'met', 'my', 'needs', '.', 'i', 'do', 'appreciate', 'being', 'served', 'by', 'such', 'people', '.', 'well', 'done', 'to', 'her', '.']","{'neg': 0.0, 'neu': 0.745, 'pos': 0.255, 'compound': 0.7823}"
"Excellent customer service, great staff .","['excellent', 'customer', 'service', ',', 'great', 'staff', '.']","{'neg': 0.0, 'neu': 0.278, 'pos': 0.722, 'compound': 0.8316}"
"Andreea was superb, explained and found the best deal for me and did everything she could to help! I will definitely visit the Corby store again! I would give her 10 stars if possible.","['andreea', 'was', 'superb', ',', 'explained', 'and', 'found', 'the', 'best', 'deal', 'for', 'me', 'and', 'did', 'everything', 'she', 'could', 'to', 'help', '!', 'i', 'will', 'definitely', 'visit', 'the', 'corby', 'store', 'again', '!', 'i', 'would', 'give', 'her', '10', 'stars', 'if', 'possible', '.']","{'neg': 0.0, 'neu': 0.662, 'pos': 0.338, 'compound': 0.9358}"
Excellent advice and support. I will be back to see Mike.,"['excellent', 'advice', 'and', 'support', '.', 'i', 'will', 'be', 'back', 'to', 'see', 'mike', '.']","{'neg': 0.0, 'neu': 0.556, 'pos': 0.444, 'compound': 0.7506}"
Finbar give me fantastic service as always. Only person I will have take care of me and my family.,"['finbar', 'give', 'me', 'fantastic', 'service', 'as', 'always', '.', 'only', 'person', 'i', 'will', 'have', 'take', 'care', 'of', 'me', 'and', 'my', 'family', '.']","{'neg': 0.0, 'neu': 0.702, 'pos': 0.298, 'compound': 0.7783}"
I have had nothing but excellent service from Vodafone U.K.-Spalding. Have visited on several occasions and always very very helpful,"['i', 'have', 'had', 'nothing', 'but', 'excellent', 'service', 'from', 'vodafone', 'u.k.-spalding', '.', 'have', 'visited', 'on', 'several', 'occasions', 'and', 'always', 'very', 'very', 'helpful']","{'neg': 0.156, 'neu': 0.665, 'pos': 0.178, 'compound': 0.1431}"
"Your member of staff was so efficient , friendly and polite . He answered all our questions with clear explanations . His suggestion of a dongle for our caravan was excellent . Wish I had one years ago . I don’t feel rushed and  felt that Christopher definitely went the extra mile with his service . He was friendly , happy and welcoming and I am sure a real asset to your business . Please pass on our thanks Debbie Harvey","['your', 'member', 'of', 'staff', 'was', 'so', 'efficient', ',', 'friendly', 'and', 'polite', '.', 'he', 'answered', 'all', 'our', 'questions', 'with', 'clear', 'explanations', '.', 'his', 'suggestion', 'of', 'a', 'dongle', 'for', 'our', 'caravan', 'was', 'excellent', '.', 'wish', 'i', 'had', 'one', 'years', 'ago', '.', 'i', 'don', '’', 't', 'feel', 'rushed', 'and', 'felt', 'that', 'christopher', 'definitely', 'went', 'the', 'extra', 'mile', 'with', 'his', 'service', '.', 'he', 'was', 'friendly', ',', 'happy', 'and', 'welcoming', 'and', 'i', 'am', 'sure', 'a', 'real', 'asset', 'to', 'your', 'business', '.', 'please', 'pass', 'on', 'our', 'thanks', 'debbie', 'harvey']","{'neg': 0.0, 'neu': 0.586, 'pos': 0.414, 'compound': 0.989}"
Katie with purple hair was very helpful today and helped us a lot thanks,"['katie', 'with', 'purple', 'hair', 'was', 'very', 'helpful', 'today', 'and', 'helped', 'us', 'a', 'lot', 'thanks']","{'neg': 0.0, 'neu': 0.647, 'pos': 0.353, 'compound': 0.7178}"
Both sales agents provided a fantastic service!,"['both', 'sales', 'agents', 'provided', 'a', 'fantastic', 'service', '!']","{'neg': 0.0, 'neu': 0.562, 'pos': 0.438, 'compound': 0.5983}"
Very helpful and avoided a formal complaint to head office through his assistance,"['very', 'helpful', 'and', 'avoided', 'a', 'formal', 'complaint', 'to', 'head', 'office', 'through', 'his', 'assistance']","{'neg': 0.287, 'neu': 0.531, 'pos': 0.182, 'compound': -0.1952}"
"Shaun was very helpful and was able to reduce my monthly bill. He was very friendly, professional and polite","['shaun', 'was', 'very', 'helpful', 'and', 'was', 'able', 'to', 'reduce', 'my', 'monthly', 'bill', '.', 'he', 'was', 'very', 'friendly', ',', 'professional', 'and', 'polite']","{'neg': 0.0, 'neu': 0.721, 'pos': 0.279, 'compound': 0.764}"
What great customer service would definitely recommend this shop wonderful team,"['what', 'great', 'customer', 'service', 'would', 'definitely', 'recommend', 'this', 'shop', 'wonderful', 'team']","{'neg': 0.0, 'neu': 0.35, 'pos': 0.65, 'compound': 0.9186}"
Mark was really helpful today in the plymouth store. Helped us get what we wanted and rectify a few issues with Vodafone. Brilliant customer service and really helpful,"['mark', 'was', 'really', 'helpful', 'today', 'in', 'the', 'plymouth', 'store', '.', 'helped', 'us', 'get', 'what', 'we', 'wanted', 'and', 'rectify', 'a', 'few', 'issues', 'with', 'vodafone', '.', 'brilliant', 'customer', 'service', 'and', 'really', 'helpful']","{'neg': 0.0, 'neu': 0.706, 'pos': 0.294, 'compound': 0.8746}"
"Excellent service from pamir and the team  , I went to them to ask about any new cheap plans because i am upgrading mine soon , pamir explain to me and give me   various option and good auggestions . he  were so helpful and dealt with my request with  a friendly manner.","['excellent', 'service', 'from', 'pamir', 'and', 'the', 'team', ',', 'i', 'went', 'to', 'them', 'to', 'ask', 'about', 'any', 'new', 'cheap', 'plans', 'because', 'i', 'am', 'upgrading', 'mine', 'soon', ',', 'pamir', 'explain', 'to', 'me', 'and', 'give', 'me', 'various', 'option', 'and', 'good', 'auggestions', '.', 'he', 'were', 'so', 'helpful', 'and', 'dealt', 'with', 'my', 'request', 'with', 'a', 'friendly', 'manner', '.']","{'neg': 0.0, 'neu': 0.758, 'pos': 0.242, 'compound': 0.9248}"
Cant speak highly enough of lila went above and beyond for me,"['cant', 'speak', 'highly', 'enough', 'of', 'lila', 'went', 'above', 'and', 'beyond', 'for', 'me']","{'neg': 0.0, 'neu': 1.0, 'pos': 0.0, 'compound': 0.0}"
Great customer service here at Craigavon branch. Had considered leaving Vodafone but my faith in the customer service has been restored. All the staff were wonderful.,"['great', 'customer', 'service', 'here', 'at', 'craigavon', 'branch', '.', 'had', 'considered', 'leaving', 'vodafone', 'but', 'my', 'faith', 'in', 'the', 'customer', 'service', 'has', 'been', 'restored', '.', 'all', 'the', 'staff', 'were', 'wonderful', '.']","{'neg': 0.0, 'neu': 0.604, 'pos': 0.396, 'compound': 0.9371}"
Thanks to Michael for all his help today setting up my UK sim. He was incredibly patient when I was about to give up and go home. I’m don’t know what I would have done without his assistance,"['thanks', 'to', 'michael', 'for', 'all', 'his', 'help', 'today', 'setting', 'up', 'my', 'uk', 'sim', '.', 'he', 'was', 'incredibly', 'patient', 'when', 'i', 'was', 'about', 'to', 'give', 'up', 'and', 'go', 'home', '.', 'i', '’', 'm', 'don', '’', 't', 'know', 'what', 'i', 'would', 'have', 'done', 'without', 'his', 'assistance']","{'neg': 0.0, 'neu': 0.855, 'pos': 0.145, 'compound': 0.6808}"
Jon has been fantastic today tha k you,"['jon', 'has', 'been', 'fantastic', 'today', 'tha', 'k', 'you']","{'neg': 0.0, 'neu': 0.625, 'pos': 0.375, 'compound': 0.5574}"
Bruno was great in finding me the deal that was right for me. Really pleased with the amount of money I will be saving. Thank you!,"['bruno', 'was', 'great', 'in', 'finding', 'me', 'the', 'deal', 'that', 'was', 'right', 'for', 'me', '.', 'really', 'pleased', 'with', 'the', 'amount', 'of', 'money', 'i', 'will', 'be', 'saving', '.', 'thank', 'you', '!']","{'neg': 0.0, 'neu': 0.686, 'pos': 0.314, 'compound': 0.8775}"
"Amazing service by Edele, super efficient and super friendly. I will definitely return.","['amazing', 'service', 'by', 'edele', ',', 'super', 'efficient', 'and', 'super', 'friendly', '.', 'i', 'will', 'definitely', 'return', '.']","{'neg': 0.0, 'neu': 0.228, 'pos': 0.772, 'compound': 0.9652}"
It was a very good and the man was just great helpful  and fast at meeting my needs,"['it', 'was', 'a', 'very', 'good', 'and', 'the', 'man', 'was', 'just', 'great', 'helpful', 'and', 'fast', 'at', 'meeting', 'my', 'needs']","{'neg': 0.0, 'neu': 0.581, 'pos': 0.419, 'compound': 0.8777}"
"Chris was very good, made it easy to understand","['chris', 'was', 'very', 'good', ',', 'made', 'it', 'easy', 'to', 'understand']","{'neg': 0.0, 'neu': 0.535, 'pos': 0.465, 'compound': 0.7264}"
Great customer service from Simon. Very helpful.,"['great', 'customer', 'service', 'from', 'simon', '.', 'very', 'helpful', '.']","{'neg': 0.0, 'neu': 0.41, 'pos': 0.59, 'compound': 0.8016}"
Luca has been AMAZING and has helped me so much. He is great!!,"['luca', 'has', 'been', 'amazing', 'and', 'has', 'helped', 'me', 'so', 'much', '.', 'he', 'is', 'great', '!', '!']","{'neg': 0.0, 'neu': 0.565, 'pos': 0.435, 'compound': 0.8585}"
"William , Hemel Hempstead store Help to mee very well and met all my requirements.","['william', ',', 'hemel', 'hempstead', 'store', 'help', 'to', 'mee', 'very', 'well', 'and', 'met', 'all', 'my', 'requirements', '.']","{'neg': 0.0, 'neu': 0.702, 'pos': 0.298, 'compound': 0.624}"
Very helpfull and polite and knowable thank you,"['very', 'helpfull', 'and', 'polite', 'and', 'knowable', 'thank', 'you']","{'neg': 0.0, 'neu': 0.737, 'pos': 0.263, 'compound': 0.3612}"
"Aayushi has been so helpful, clear to explain any changes and quick to complete the changes wanted thank you","['aayushi', 'has', 'been', 'so', 'helpful', ',', 'clear', 'to', 'explain', 'any', 'changes', 'and', 'quick', 'to', 'complete', 'the', 'changes', 'wanted', 'thank', 'you']","{'neg': 0.0, 'neu': 0.64, 'pos': 0.36, 'compound': 0.8399}"
A very professional lady served me called Alexy she had amazing service. She found me a great deal. Thank you.,"['a', 'very', 'professional', 'lady', 'served', 'me', 'called', 'alexy', 'she', 'had', 'amazing', 'service', '.', 'she', 'found', 'me', 'a', 'great', 'deal', '.', 'thank', 'you', '.']","{'neg': 0.0, 'neu': 0.591, 'pos': 0.409, 'compound': 0.886}"
"I was a little anxious about how this contract review would go.I need not have had any worries:Dan Morrissey was polite, easy to understand, professional and the whole experience could not have been more satisfactory.Thank you Dan!","['i', 'was', 'a', 'little', 'anxious', 'about', 'how', 'this', 'contract', 'review', 'would', 'go.i', 'need', 'not', 'have', 'had', 'any', 'worries', ':', 'dan', 'morrissey', 'was', 'polite', ',', 'easy', 'to', 'understand', ',', 'professional', 'and', 'the', 'whole', 'experience', 'could', 'not', 'have', 'been', 'more', 'satisfactory.thank', 'you', 'dan', '!']","{'neg': 0.118, 'neu': 0.811, 'pos': 0.071, 'compound': -0.2261}"
Jamal was extremely helpful and informative.,"['jamal', 'was', 'extremely', 'helpful', 'and', 'informative', '.']","{'neg': 0.0, 'neu': 0.618, 'pos': 0.382, 'compound': 0.4754}"
Staff are always very helpful and knowledgeable. Have always received good customer service.,"['staff', 'are', 'always', 'very', 'helpful', 'and', 'knowledgeable', '.', 'have', 'always', 'received', 'good', 'customer', 'service', '.']","{'neg': 0.0, 'neu': 0.647, 'pos': 0.353, 'compound': 0.7178}"
My current Vodafone contract finishes this month. I’ve just come to the Vodafone shop at Meadowhall for advice hoping to carry on with this phone but wondering if I would be better with a new one. I was expertly advised by Abi who explained the different options and as this phone is working perfectly I decided to keep it. She explained that I could review this decision in 3 months if I wanted. I was very pleased with the new contract which gives me 6GB a month for £18. I had previously been paying £47.Thanks so much to Abi for her efficiency and advice in helping me today.,"['my', 'current', 'vodafone', 'contract', 'finishes', 'this', 'month', '.', 'i', '’', 've', 'just', 'come', 'to', 'the', 'vodafone', 'shop', 'at', 'meadowhall', 'for', 'advice', 'hoping', 'to', 'carry', 'on', 'with', 'this', 'phone', 'but', 'wondering', 'if', 'i', 'would', 'be', 'better', 'with', 'a', 'new', 'one', '.', 'i', 'was', 'expertly', 'advised', 'by', 'abi', 'who', 'explained', 'the', 'different', 'options', 'and', 'as', 'this', 'phone', 'is', 'working', 'perfectly', 'i', 'decided', 'to', 'keep', 'it', '.', 'she', 'explained', 'that', 'i', 'could', 'review', 'this', 'decision', 'in', '3', 'months', 'if', 'i', 'wanted', '.', 'i', 'was', 'very', 'pleased', 'with', 'the', 'new', 'contract', 'which', 'gives', 'me', '6gb', 'a', 'month', 'for', '£18', '.', 'i', 'had', 'previously', 'been', 'paying', '£47.thanks', 'so', 'much', 'to', 'abi', 'for', 'her', 'efficiency', 'and', 'advice', 'in', 'helping', 'me', 'today', '.']","{'neg': 0.0, 'neu': 0.808, 'pos': 0.192, 'compound': 0.9716}"
Kingdroad Vodafone Store.  My visit wad geser and Quick.  VOXI renewal. Beauty Made it so easy.  Thank you,"['kingdroad', 'vodafone', 'store', '.', 'my', 'visit', 'wad', 'geser', 'and', 'quick', '.', 'voxi', 'renewal', '.', 'beauty', 'made', 'it', 'so', 'easy', '.', 'thank', 'you']","{'neg': 0.0, 'neu': 0.592, 'pos': 0.408, 'compound': 0.8839}"
"Upgraded in Jan 23, Vodafone then stopped the wrong direct debit, then transferred my case to a debt collection agency after id proved it was their fault. Terrible company, hours on the phone on hold and the cannot sort out a simple mistake they have made.","['upgraded', 'in', 'jan', '23', ',', 'vodafone', 'then', 'stopped', 'the', 'wrong', 'direct', 'debit', ',', 'then', 'transferred', 'my', 'case', 'to', 'a', 'debt', 'collection', 'agency', 'after', 'id', 'proved', 'it', 'was', 'their', 'fault', '.', 'terrible', 'company', ',', 'hours', 'on', 'the', 'phone', 'on', 'hold', 'and', 'the', 'can', 'not', 'sort', 'out', 'a', 'simple', 'mistake', 'they', 'have', 'made', '.']","{'neg': 0.287, 'neu': 0.713, 'pos': 0.0, 'compound': -0.9287}"
"Avoid at all costI went in to see what's on offer as I'm out of contract with EE. The polish man was not interested one bit. He was rude and kept on telling me there's nothing he can do. He even answered his phone and started speak in polish while he was talking to me, that's how interested he was in serving me.I'm glad I didn't join Vodafone, because if that's the kind of people they have working there, then can you imagine if I went in with a problem.","['avoid', 'at', 'all', 'costi', 'went', 'in', 'to', 'see', 'what', ""'s"", 'on', 'offer', 'as', 'i', ""'m"", 'out', 'of', 'contract', 'with', 'ee', '.', 'the', 'polish', 'man', 'was', 'not', 'interested', 'one', 'bit', '.', 'he', 'was', 'rude', 'and', 'kept', 'on', 'telling', 'me', 'there', ""'s"", 'nothing', 'he', 'can', 'do', '.', 'he', 'even', 'answered', 'his', 'phone', 'and', 'started', 'speak', 'in', 'polish', 'while', 'he', 'was', 'talking', 'to', 'me', ',', 'that', ""'s"", 'how', 'interested', 'he', 'was', 'in', 'serving', 'me.i', ""'m"", 'glad', 'i', 'did', ""n't"", 'join', 'vodafone', ',', 'because', 'if', 'that', ""'s"", 'the', 'kind', 'of', 'people', 'they', 'have', 'working', 'there', ',', 'then', 'can', 'you', 'imagine', 'if', 'i', 'went', 'in', 'with', 'a', 'problem', '.']","{'neg': 0.138, 'neu': 0.832, 'pos': 0.029, 'compound': -0.852}"
"Naz was very helpful, very knowledgable and very friendly.","['naz', 'was', 'very', 'helpful', ',', 'very', 'knowledgable', 'and', 'very', 'friendly', '.']","{'neg': 0.0, 'neu': 0.515, 'pos': 0.485, 'compound': 0.764}"
Help with connection with data at Vodafone in Elgin,"['help', 'with', 'connection', 'with', 'data', 'at', 'vodafone', 'in', 'elgin']","{'neg': 0.0, 'neu': 0.748, 'pos': 0.252, 'compound': 0.4019}"
"Fantastic experience this morning from the guys at the Parkgate store, no problem too big, explained everything perfectly and even sorted me out a new laptop, big shoutout to James who sorted everything for me, cheers","['fantastic', 'experience', 'this', 'morning', 'from', 'the', 'guys', 'at', 'the', 'parkgate', 'store', ',', 'no', 'problem', 'too', 'big', ',', 'explained', 'everything', 'perfectly', 'and', 'even', 'sorted', 'me', 'out', 'a', 'new', 'laptop', ',', 'big', 'shoutout', 'to', 'james', 'who', 'sorted', 'everything', 'for', 'me', ',', 'cheers']","{'neg': 0.107, 'neu': 0.655, 'pos': 0.238, 'compound': 0.7906}"
Great customer service. Would recommend to my friends.,"['great', 'customer', 'service', '.', 'would', 'recommend', 'to', 'my', 'friends', '.']","{'neg': 0.0, 'neu': 0.34, 'pos': 0.66, 'compound': 0.8658}"
I was served by amin and junior. Excellent service delighted with the first class attention I recieve every time I come in. I cannot praise your staff highly enough they are a credit to your organisation.,"['i', 'was', 'served', 'by', 'amin', 'and', 'junior', '.', 'excellent', 'service', 'delighted', 'with', 'the', 'first', 'class', 'attention', 'i', 'recieve', 'every', 'time', 'i', 'come', 'in', '.', 'i', 'can', 'not', 'praise', 'your', 'staff', 'highly', 'enough', 'they', 'are', 'a', 'credit', 'to', 'your', 'organisation', '.']","{'neg': 0.072, 'neu': 0.691, 'pos': 0.237, 'compound': 0.7701}"
"James, Scott & Lucas all contributed to make my visit to the store worthwhile. The level of customer service they offered was brilliant and so rare these days","['james', ',', 'scott', '&', 'lucas', 'all', 'contributed', 'to', 'make', 'my', 'visit', 'to', 'the', 'store', 'worthwhile', '.', 'the', 'level', 'of', 'customer', 'service', 'they', 'offered', 'was', 'brilliant', 'and', 'so', 'rare', 'these', 'days']","{'neg': 0.0, 'neu': 0.801, 'pos': 0.199, 'compound': 0.7351}"
"Worst of the worst company I've ever had to deal with for customer services. They keep over charging me by over double for my bill!! After many polite conversations with customer services, they are apologetic, but do not do anything to fix it! How can a company of this size get it so wrong?NEVER USE VODAFONE!!(this is my worst experience with a company, and I hardly ever complain about anything)","['worst', 'of', 'the', 'worst', 'company', 'i', ""'ve"", 'ever', 'had', 'to', 'deal', 'with', 'for', 'customer', 'services', '.', 'they', 'keep', 'over', 'charging', 'me', 'by', 'over', 'double', 'for', 'my', 'bill', '!', '!', 'after', 'many', 'polite', 'conversations', 'with', 'customer', 'services', ',', 'they', 'are', 'apologetic', ',', 'but', 'do', 'not', 'do', 'anything', 'to', 'fix', 'it', '!', 'how', 'can', 'a', 'company', 'of', 'this', 'size', 'get', 'it', 'so', 'wrong', '?', 'never', 'use', 'vodafone', '!', '!', '(', 'this', 'is', 'my', 'worst', 'experience', 'with', 'a', 'company', ',', 'and', 'i', 'hardly', 'ever', 'complain', 'about', 'anything', ')']","{'neg': 0.24, 'neu': 0.76, 'pos': 0.0, 'compound': -0.9692}"
