revs,Preprocessed_Text,Sentiment_Scores
Fabulous customer service! What an asset to the team! Thank you Jacob!,"['fabulous', 'customer', 'service', '!', 'what', 'an', 'asset', 'to', 'the', 'team', '!', 'thank', 'you', 'jacob', '!']","{'neg': 0.0, 'neu': 0.492, 'pos': 0.508, 'compound': 0.851}"
"AndreeaShe was absolutely amazing! Really nice and really helpful, she was able to do everything what i asked for.i am absolutely happy with everything.","['andreeashe', 'was', 'absolutely', 'amazing', '!', 'really', 'nice', 'and', 'really', 'helpful', ',', 'she', 'was', 'able', 'to', 'do', 'everything', 'what', 'i', 'asked', 'for.i', 'am', 'absolutely', 'happy', 'with', 'everything', '.']","{'neg': 0.0, 'neu': 0.562, 'pos': 0.438, 'compound': 0.9416}"
We have been in for various upgrades and additions to our account. We have spoken to Natalie each time and she has been fantastic! So helpful and always bubbly making the process an enjoyable experience even when the system is on a go slow. Thank you for all the help your awesome!,"['we', 'have', 'been', 'in', 'for', 'various', 'upgrades', 'and', 'additions', 'to', 'our', 'account', '.', 'we', 'have', 'spoken', 'to', 'natalie', 'each', 'time', 'and', 'she', 'has', 'been', 'fantastic', '!', 'so', 'helpful', 'and', 'always', 'bubbly', 'making', 'the', 'process', 'an', 'enjoyable', 'experience', 'even', 'when', 'the', 'system', 'is', 'on', 'a', 'go', 'slow', '.', 'thank', 'you', 'for', 'all', 'the', 'help', 'your', 'awesome', '!']","{'neg': 0.0, 'neu': 0.692, 'pos': 0.308, 'compound': 0.9638}"
"It's like a contract with the Mafia!I've been with Vodafone for years, probably over 23 years. When things go well they're fine and the staff at the shops are great. That's where any positive aspects end.This phone is a back up phone as I have a company mobile that allows personal use and so it mostly sits in a drawer gathering dust.8 years ago I moved to a house where Vodafone's signal was abysmal. Daughter on Three was fine and partner on O2 fine. When I contacted Vodafone they denied a problem and tried to sell me the Sure Signal package. I spent over an hour on the phone with them getting them to zoom into the map closer to the point where they could actually see the house sits in a signal blackspot! I can get signal in the garden but in the house I have to move to one corner in an upstairs room to get 1-2 bars. Finally they relented and gave me the sure signal box free but only after I threatened to move networks. One point worth mentioning about sure signal or any connection over WiFi/Internet, the App refuses to let you into your account unless you're on mobile data so it's a pretty pointless app for me. With sure signal I was able to get texts and calls etc again so I left it at that. The phone returned to the drawer with only occasional use. Roll forward to today - Sure Signal is no longer active as they withdrew the service as most phones are WiFi calling enabled - I don't know that mine is.Today I see the bill has gone up 13% - I can get a SIM only deal with unlimited data/calls/text for £10/month less so I figure it's time to switch.Text PAC to 65075 and get a message back saying they don't understand my message and if I want to get a PAC code I need to text my PAC and my PIN - sounds a bit dodgy so I go to Vodafone/leaving and follow the instructions which tells me to go to my account. Guess what - they're having technical difficulties so I can't log in. I'm hard of hearing so calling someone isn't an option.So it looks like I need to go into a store to sort this out. Nothing is ever simple or straightforward with this company","['it', ""'s"", 'like', 'a', 'contract', 'with', 'the', 'mafia', '!', 'i', ""'ve"", 'been', 'with', 'vodafone', 'for', 'years', ',', 'probably', 'over', '23', 'years', '.', 'when', 'things', 'go', 'well', 'they', ""'re"", 'fine', 'and', 'the', 'staff', 'at', 'the', 'shops', 'are', 'great', '.', 'that', ""'s"", 'where', 'any', 'positive', 'aspects', 'end.this', 'phone', 'is', 'a', 'back', 'up', 'phone', 'as', 'i', 'have', 'a', 'company', 'mobile', 'that', 'allows', 'personal', 'use', 'and', 'so', 'it', 'mostly', 'sits', 'in', 'a', 'drawer', 'gathering', 'dust.8', 'years', 'ago', 'i', 'moved', 'to', 'a', 'house', 'where', 'vodafone', ""'s"", 'signal', 'was', 'abysmal', '.', 'daughter', 'on', 'three', 'was', 'fine', 'and', 'partner', 'on', 'o2', 'fine', '.', 'when', 'i', 'contacted', 'vodafone', 'they', 'denied', 'a', 'problem', 'and', 'tried', 'to', 'sell', 'me', 'the', 'sure', 'signal', 'package', '.', 'i', 'spent', 'over', 'an', 'hour', 'on', 'the', 'phone', 'with', 'them', 'getting', 'them', 'to', 'zoom', 'into', 'the', 'map', 'closer', 'to', 'the', 'point', 'where', 'they', 'could', 'actually', 'see', 'the', 'house', 'sits', 'in', 'a', 'signal', 'blackspot', '!', 'i', 'can', 'get', 'signal', 'in', 'the', 'garden', 'but', 'in', 'the', 'house', 'i', 'have', 'to', 'move', 'to', 'one', 'corner', 'in', 'an', 'upstairs', 'room', 'to', 'get', '1-2', 'bars', '.', 'finally', 'they', 'relented', 'and', 'gave', 'me', 'the', 'sure', 'signal', 'box', 'free', 'but', 'only', 'after', 'i', 'threatened', 'to', 'move', 'networks', '.', 'one', 'point', 'worth', 'mentioning', 'about', 'sure', 'signal', 'or', 'any', 'connection', 'over', 'wifi/internet', ',', 'the', 'app', 'refuses', 'to', 'let', 'you', 'into', 'your', 'account', 'unless', 'you', ""'re"", 'on', 'mobile', 'data', 'so', 'it', ""'s"", 'a', 'pretty', 'pointless', 'app', 'for', 'me', '.', 'with', 'sure', 'signal', 'i', 'was', 'able', 'to', 'get', 'texts', 'and', 'calls', 'etc', 'again', 'so', 'i', 'left', 'it', 'at', 'that', '.', 'the', 'phone', 'returned', 'to', 'the', 'drawer', 'with', 'only', 'occasional', 'use', '.', 'roll', 'forward', 'to', 'today', '-', 'sure', 'signal', 'is', 'no', 'longer', 'active', 'as', 'they', 'withdrew', 'the', 'service', 'as', 'most', 'phones', 'are', 'wifi', 'calling', 'enabled', '-', 'i', 'do', ""n't"", 'know', 'that', 'mine', 'is.today', 'i', 'see', 'the', 'bill', 'has', 'gone', 'up', '13', '%', '-', 'i', 'can', 'get', 'a', 'sim', 'only', 'deal', 'with', 'unlimited', 'data/calls/text', 'for', '£10/month', 'less', 'so', 'i', 'figure', 'it', ""'s"", 'time', 'to', 'switch.text', 'pac', 'to', '65075', 'and', 'get', 'a', 'message', 'back', 'saying', 'they', 'do', ""n't"", 'understand', 'my', 'message', 'and', 'if', 'i', 'want', 'to', 'get', 'a', 'pac', 'code', 'i', 'need', 'to', 'text', 'my', 'pac', 'and', 'my', 'pin', '-', 'sounds', 'a', 'bit', 'dodgy', 'so', 'i', 'go', 'to', 'vodafone/leaving', 'and', 'follow', 'the', 'instructions', 'which', 'tells', 'me', 'to', 'go', 'to', 'my', 'account', '.', 'guess', 'what', '-', 'they', ""'re"", 'having', 'technical', 'difficulties', 'so', 'i', 'ca', ""n't"", 'log', 'in', '.', 'i', ""'m"", 'hard', 'of', 'hearing', 'so', 'calling', 'someone', 'is', ""n't"", 'an', 'option.so', 'it', 'looks', 'like', 'i', 'need', 'to', 'go', 'into', 'a', 'store', 'to', 'sort', 'this', 'out', '.', 'nothing', 'is', 'ever', 'simple', 'or', 'straightforward', 'with', 'this', 'company']","{'neg': 0.042, 'neu': 0.847, 'pos': 0.111, 'compound': 0.9771}"
"Vodafone has a whole clearly doesn't want me as a customer any moreProbably been with them for 10 years and till recently never really had any problems.But wouldn't let me upgrade early,so waited until the end of my contract still won't let me upgrade ( but can put prices up nearly 15 percent on my bill)I am in full time employment, on the electoral roll, lived at the same address for over 11 years, open bank accounts with no arrears, just ordered a new £40,000 car on finance, not in any bother with police or legal systems, don't drink smoke or do any form of drugsIn my eyes a polite person who needs a reliable phone as I travel well over 25,000 miles a year driving and for some reason not eligible or the type of individual that Vodafone is looking for business from !!Well that's absolutely fine with me I am sure that other phone providers will be willing to take some of my hard earned money from meKind regardsJames","['vodafone', 'has', 'a', 'whole', 'clearly', 'does', ""n't"", 'want', 'me', 'as', 'a', 'customer', 'any', 'moreprobably', 'been', 'with', 'them', 'for', '10', 'years', 'and', 'till', 'recently', 'never', 'really', 'had', 'any', 'problems.but', 'would', ""n't"", 'let', 'me', 'upgrade', 'early', ',', 'so', 'waited', 'until', 'the', 'end', 'of', 'my', 'contract', 'still', 'wo', ""n't"", 'let', 'me', 'upgrade', '(', 'but', 'can', 'put', 'prices', 'up', 'nearly', '15', 'percent', 'on', 'my', 'bill', ')', 'i', 'am', 'in', 'full', 'time', 'employment', ',', 'on', 'the', 'electoral', 'roll', ',', 'lived', 'at', 'the', 'same', 'address', 'for', 'over', '11', 'years', ',', 'open', 'bank', 'accounts', 'with', 'no', 'arrears', ',', 'just', 'ordered', 'a', 'new', '£40,000', 'car', 'on', 'finance', ',', 'not', 'in', 'any', 'bother', 'with', 'police', 'or', 'legal', 'systems', ',', 'do', ""n't"", 'drink', 'smoke', 'or', 'do', 'any', 'form', 'of', 'drugsin', 'my', 'eyes', 'a', 'polite', 'person', 'who', 'needs', 'a', 'reliable', 'phone', 'as', 'i', 'travel', 'well', 'over', '25,000', 'miles', 'a', 'year', 'driving', 'and', 'for', 'some', 'reason', 'not', 'eligible', 'or', 'the', 'type', 'of', 'individual', 'that', 'vodafone', 'is', 'looking', 'for', 'business', 'from', '!', '!', 'well', 'that', ""'s"", 'absolutely', 'fine', 'with', 'me', 'i', 'am', 'sure', 'that', 'other', 'phone', 'providers', 'will', 'be', 'willing', 'to', 'take', 'some', 'of', 'my', 'hard', 'earned', 'money', 'from', 'mekind', 'regardsjames']","{'neg': 0.03, 'neu': 0.872, 'pos': 0.097, 'compound': 0.9025}"
"Terrible service, rude arrogant customer support that jsut repeat themselves over and over instead of trying to solve a problem. Sent me the wrong phone, then when I called to resolve the issue , was put on hold for 10 mins only to be told as we are small business instead of a larger one I need to wait till tommorw, further delaying me in reviving a replacement phone","['terrible', 'service', ',', 'rude', 'arrogant', 'customer', 'support', 'that', 'jsut', 'repeat', 'themselves', 'over', 'and', 'over', 'instead', 'of', 'trying', 'to', 'solve', 'a', 'problem', '.', 'sent', 'me', 'the', 'wrong', 'phone', ',', 'then', 'when', 'i', 'called', 'to', 'resolve', 'the', 'issue', ',', 'was', 'put', 'on', 'hold', 'for', '10', 'mins', 'only', 'to', 'be', 'told', 'as', 'we', 'are', 'small', 'business', 'instead', 'of', 'a', 'larger', 'one', 'i', 'need', 'to', 'wait', 'till', 'tommorw', ',', 'further', 'delaying', 'me', 'in', 'reviving', 'a', 'replacement', 'phone']","{'neg': 0.196, 'neu': 0.712, 'pos': 0.092, 'compound': -0.8402}"
Nick was very amazing and very helpful with upgrading my phone.,"['nick', 'was', 'very', 'amazing', 'and', 'very', 'helpful', 'with', 'upgrading', 'my', 'phone', '.']","{'neg': 0.0, 'neu': 0.556, 'pos': 0.444, 'compound': 0.8012}"
"Gave 1 months notice on phone. Told nothing due as pay upfront. Closed account. They then decide to chase us for money, then bead credit us! Worst company ever! Major issues with them! Avoid at all costs!Margaret has contacted me to try and sort out. Let’s see what happens","['gave', '1', 'months', 'notice', 'on', 'phone', '.', 'told', 'nothing', 'due', 'as', 'pay', 'upfront', '.', 'closed', 'account', '.', 'they', 'then', 'decide', 'to', 'chase', 'us', 'for', 'money', ',', 'then', 'bead', 'credit', 'us', '!', 'worst', 'company', 'ever', '!', 'major', 'issues', 'with', 'them', '!', 'avoid', 'at', 'all', 'costs', '!', 'margaret', 'has', 'contacted', 'me', 'to', 'try', 'and', 'sort', 'out', '.', 'let', '’', 's', 'see', 'what', 'happens']","{'neg': 0.132, 'neu': 0.798, 'pos': 0.069, 'compound': -0.678}"
My assistant went above and beyond and was very informative.,"['my', 'assistant', 'went', 'above', 'and', 'beyond', 'and', 'was', 'very', 'informative', '.']","{'neg': 0.0, 'neu': 1.0, 'pos': 0.0, 'compound': 0.0}"
"Excellent customer service from Lorna. Feel like I got value for money and a fantastic deal, much better than competitors (EE, o2 etc).","['excellent', 'customer', 'service', 'from', 'lorna', '.', 'feel', 'like', 'i', 'got', 'value', 'for', 'money', 'and', 'a', 'fantastic', 'deal', ',', 'much', 'better', 'than', 'competitors', '(', 'ee', ',', 'o2', 'etc', ')', '.']","{'neg': 0.0, 'neu': 0.514, 'pos': 0.486, 'compound': 0.9337}"
"Upgraded to new iphone today, Lorna was fantastic she explained everything comprehensively and broke down the plan/tariff etc in detail. Store was very busy but still made me feel like I was the only one there. Seamless experience from beginning to end, highly recommend! :)","['upgraded', 'to', 'new', 'iphone', 'today', ',', 'lorna', 'was', 'fantastic', 'she', 'explained', 'everything', 'comprehensively', 'and', 'broke', 'down', 'the', 'plan/tariff', 'etc', 'in', 'detail', '.', 'store', 'was', 'very', 'busy', 'but', 'still', 'made', 'me', 'feel', 'like', 'i', 'was', 'the', 'only', 'one', 'there', '.', 'seamless', 'experience', 'from', 'beginning', 'to', 'end', ',', 'highly', 'recommend', '!', ':', ')']","{'neg': 0.038, 'neu': 0.773, 'pos': 0.189, 'compound': 0.824}"
"Great store, most staff are super friendly and quite knowledgeable. Dylan in particular helped me solving an issue I had with my SIM card.","['great', 'store', ',', 'most', 'staff', 'are', 'super', 'friendly', 'and', 'quite', 'knowledgeable', '.', 'dylan', 'in', 'particular', 'helped', 'me', 'solving', 'an', 'issue', 'i', 'had', 'with', 'my', 'sim', 'card', '.']","{'neg': 0.0, 'neu': 0.578, 'pos': 0.422, 'compound': 0.9308}"
Very pleasant and patient explaining all the options.,"['very', 'pleasant', 'and', 'patient', 'explaining', 'all', 'the', 'options', '.']","{'neg': 0.0, 'neu': 0.661, 'pos': 0.339, 'compound': 0.5563}"
"I visited the store looking to upgrade my current device, I was warmly greeted by Michael. He was really personable and just like the title says he knew his stuff. He asked questions about about my interests and lifestyle and matched me with a device (s23).","['i', 'visited', 'the', 'store', 'looking', 'to', 'upgrade', 'my', 'current', 'device', ',', 'i', 'was', 'warmly', 'greeted', 'by', 'michael', '.', 'he', 'was', 'really', 'personable', 'and', 'just', 'like', 'the', 'title', 'says', 'he', 'knew', 'his', 'stuff', '.', 'he', 'asked', 'questions', 'about', 'about', 'my', 'interests', 'and', 'lifestyle', 'and', 'matched', 'me', 'with', 'a', 'device', '(', 's23', ')', '.']","{'neg': 0.0, 'neu': 0.807, 'pos': 0.193, 'compound': 0.8074}"
"I don’t know where to begin with this company. But if you have any kind of problem, rest assured it either won’t be solved or it will be an uphill battle. The left hand never knows what the right hand is doing. I’m actually amazed it manages an average score on here.Can’t wait until my contact is up, so I can change to another provider. This time I’ll do my homework and find one with good customer service.I’m actually exhausted from trying to solve what should be a very simple issue.","['i', 'don', '’', 't', 'know', 'where', 'to', 'begin', 'with', 'this', 'company', '.', 'but', 'if', 'you', 'have', 'any', 'kind', 'of', 'problem', ',', 'rest', 'assured', 'it', 'either', 'won', '’', 't', 'be', 'solved', 'or', 'it', 'will', 'be', 'an', 'uphill', 'battle', '.', 'the', 'left', 'hand', 'never', 'knows', 'what', 'the', 'right', 'hand', 'is', 'doing', '.', 'i', '’', 'm', 'actually', 'amazed', 'it', 'manages', 'an', 'average', 'score', 'on', 'here.can', '’', 't', 'wait', 'until', 'my', 'contact', 'is', 'up', ',', 'so', 'i', 'can', 'change', 'to', 'another', 'provider', '.', 'this', 'time', 'i', '’', 'll', 'do', 'my', 'homework', 'and', 'find', 'one', 'with', 'good', 'customer', 'service.i', '’', 'm', 'actually', 'exhausted', 'from', 'trying', 'to', 'solve', 'what', 'should', 'be', 'a', 'very', 'simple', 'issue', '.']","{'neg': 0.091, 'neu': 0.652, 'pos': 0.257, 'compound': 0.965}"
"We met a staff member called Harry today who couldn’t have been better, we didn’t even know what we wanted to do with our sim only contracts but after a questions he took charge and told us an option he had for us that was perfect and sounded very reasonable. A few moments after it was all done and we walked away happy. Thanks Harry we will be back to see him to sort out another sim contact when the time comes.","['we', 'met', 'a', 'staff', 'member', 'called', 'harry', 'today', 'who', 'couldn', '’', 't', 'have', 'been', 'better', ',', 'we', 'didn', '’', 't', 'even', 'know', 'what', 'we', 'wanted', 'to', 'do', 'with', 'our', 'sim', 'only', 'contracts', 'but', 'after', 'a', 'questions', 'he', 'took', 'charge', 'and', 'told', 'us', 'an', 'option', 'he', 'had', 'for', 'us', 'that', 'was', 'perfect', 'and', 'sounded', 'very', 'reasonable', '.', 'a', 'few', 'moments', 'after', 'it', 'was', 'all', 'done', 'and', 'we', 'walked', 'away', 'happy', '.', 'thanks', 'harry', 'we', 'will', 'be', 'back', 'to', 'see', 'him', 'to', 'sort', 'out', 'another', 'sim', 'contact', 'when', 'the', 'time', 'comes', '.']","{'neg': 0.0, 'neu': 0.825, 'pos': 0.175, 'compound': 0.9509}"
Waste time contract  still not end I found  out instead  charge  £22 I found out they charge  me  over£46! Sim ony deal worse company!,"['waste', 'time', 'contract', 'still', 'not', 'end', 'i', 'found', 'out', 'instead', 'charge', '£22', 'i', 'found', 'out', 'they', 'charge', 'me', 'over£46', '!', 'sim', 'ony', 'deal', 'worse', 'company', '!']","{'neg': 0.245, 'neu': 0.755, 'pos': 0.0, 'compound': -0.7568}"
The guys were really patient with me whilst I was having a drama about my phone dying. They explained things in simple terms and made the mobile phone jargon understandable. Thank you so much for your time (over 2 hours!).,"['the', 'guys', 'were', 'really', 'patient', 'with', 'me', 'whilst', 'i', 'was', 'having', 'a', 'drama', 'about', 'my', 'phone', 'dying', '.', 'they', 'explained', 'things', 'in', 'simple', 'terms', 'and', 'made', 'the', 'mobile', 'phone', 'jargon', 'understandable', '.', 'thank', 'you', 'so', 'much', 'for', 'your', 'time', '(', 'over', '2', 'hours', '!', ')', '.']","{'neg': 0.0, 'neu': 0.928, 'pos': 0.072, 'compound': 0.4199}"
"I never seen lıke thıs servıce ın UK before they are amazıng so kınd and support to us. After thıs servıce ı wıll talk to all my frıends to swıtch vodafone.Thank you Ahmer, and hıs staff Jabar and Albert","['i', 'never', 'seen', 'lıke', 'thıs', 'servıce', 'ın', 'uk', 'before', 'they', 'are', 'amazıng', 'so', 'kınd', 'and', 'support', 'to', 'us', '.', 'after', 'thıs', 'servıce', 'ı', 'wıll', 'talk', 'to', 'all', 'my', 'frıends', 'to', 'swıtch', 'vodafone.thank', 'you', 'ahmer', ',', 'and', 'hıs', 'staff', 'jabar', 'and', 'albert']","{'neg': 0.0, 'neu': 0.924, 'pos': 0.076, 'compound': 0.4522}"
"Jack was very professional, knowledgeable and met our needs.  He was ablely supported by other staff to deal with acouple of technical questions I had. We had an excellent experience","['jack', 'was', 'very', 'professional', ',', 'knowledgeable', 'and', 'met', 'our', 'needs', '.', 'he', 'was', 'ablely', 'supported', 'by', 'other', 'staff', 'to', 'deal', 'with', 'acouple', 'of', 'technical', 'questions', 'i', 'had', '.', 'we', 'had', 'an', 'excellent', 'experience']","{'neg': 0.0, 'neu': 0.818, 'pos': 0.182, 'compound': 0.7184}"
Straight forward and easy to deal with Shakunt. Understood our needs and met our requirement and saved us money on existing contracts too as well as sort out a completely new contract. Great service,"['straight', 'forward', 'and', 'easy', 'to', 'deal', 'with', 'shakunt', '.', 'understood', 'our', 'needs', 'and', 'met', 'our', 'requirement', 'and', 'saved', 'us', 'money', 'on', 'existing', 'contracts', 'too', 'as', 'well', 'as', 'sort', 'out', 'a', 'completely', 'new', 'contract', '.', 'great', 'service']","{'neg': 0.0, 'neu': 0.666, 'pos': 0.334, 'compound': 0.9196}"
"Henry was very patient,polite and extremely helpful","['henry', 'was', 'very', 'patient', ',', 'polite', 'and', 'extremely', 'helpful']","{'neg': 0.0, 'neu': 0.694, 'pos': 0.306, 'compound': 0.4754}"
The staff was very helpful in the St Albans store,"['the', 'staff', 'was', 'very', 'helpful', 'in', 'the', 'st', 'albans', 'store']","{'neg': 0.0, 'neu': 0.744, 'pos': 0.256, 'compound': 0.4754}"
Amazing service today in the Vodafone Craigavon store was served by Glen got me a new phone and swapped my data over,"['amazing', 'service', 'today', 'in', 'the', 'vodafone', 'craigavon', 'store', 'was', 'served', 'by', 'glen', 'got', 'me', 'a', 'new', 'phone', 'and', 'swapped', 'my', 'data', 'over']","{'neg': 0.0, 'neu': 0.84, 'pos': 0.16, 'compound': 0.5859}"
Very helpful 👌 - Prajeet,"['very', 'helpful', '👌', '-', 'prajeet']","{'neg': 0.0, 'neu': 0.393, 'pos': 0.607, 'compound': 0.4754}"
"Can I say what a high standard of customer service was shown by Josh when we went in to report a lost phone. He communicated clearly and expertly, we didn't feel talked down to by a potential 'techie'and he told us what to do, the differences between lost and stolen and supplied a replacement sim card on the spot. He went the extra mile and was a much better option than the 'bot' on the internet or the overseas techie on a long distance line. Thank you very much.And he helped us to get new SIM working when mobile was found the day after. Excellent stuff.","['can', 'i', 'say', 'what', 'a', 'high', 'standard', 'of', 'customer', 'service', 'was', 'shown', 'by', 'josh', 'when', 'we', 'went', 'in', 'to', 'report', 'a', 'lost', 'phone', '.', 'he', 'communicated', 'clearly', 'and', 'expertly', ',', 'we', 'did', ""n't"", 'feel', 'talked', 'down', 'to', 'by', 'a', 'potential', ""'techie'and"", 'he', 'told', 'us', 'what', 'to', 'do', ',', 'the', 'differences', 'between', 'lost', 'and', 'stolen', 'and', 'supplied', 'a', 'replacement', 'sim', 'card', 'on', 'the', 'spot', '.', 'he', 'went', 'the', 'extra', 'mile', 'and', 'was', 'a', 'much', 'better', 'option', 'than', 'the', ""'bot"", ""'"", 'on', 'the', 'internet', 'or', 'the', 'overseas', 'techie', 'on', 'a', 'long', 'distance', 'line', '.', 'thank', 'you', 'very', 'much.and', 'he', 'helped', 'us', 'to', 'get', 'new', 'sim', 'working', 'when', 'mobile', 'was', 'found', 'the', 'day', 'after', '.', 'excellent', 'stuff', '.']","{'neg': 0.069, 'neu': 0.826, 'pos': 0.105, 'compound': 0.6124}"
"Kayleigh was extremely helpful. She explained the different options available to us. No pressure selling. Friendly, informal but informative chat which led to our final decisions.","['kayleigh', 'was', 'extremely', 'helpful', '.', 'she', 'explained', 'the', 'different', 'options', 'available', 'to', 'us', '.', 'no', 'pressure', 'selling', '.', 'friendly', ',', 'informal', 'but', 'informative', 'chat', 'which', 'led', 'to', 'our', 'final', 'decisions', '.']","{'neg': 0.109, 'neu': 0.75, 'pos': 0.141, 'compound': 0.2374}"
"Had reason to visit my local Vodafone store today. With the intention of upgrading my phone. My point of contact was with the lovely lady Joleen. She took my details and she viewed my account, and then she reminded me that I have been paying beyond my contract date, she was very open about this and I admire her openness to this situation, my buying a new phone has now become secondary and all credit to her she held my hand in all the details. We made contact with the billing department of Vodafone in an attempt to put things right, i still have beef to resolve with the billing department at Vodafone, but Joleen of Ashford Kent your a star.","['had', 'reason', 'to', 'visit', 'my', 'local', 'vodafone', 'store', 'today', '.', 'with', 'the', 'intention', 'of', 'upgrading', 'my', 'phone', '.', 'my', 'point', 'of', 'contact', 'was', 'with', 'the', 'lovely', 'lady', 'joleen', '.', 'she', 'took', 'my', 'details', 'and', 'she', 'viewed', 'my', 'account', ',', 'and', 'then', 'she', 'reminded', 'me', 'that', 'i', 'have', 'been', 'paying', 'beyond', 'my', 'contract', 'date', ',', 'she', 'was', 'very', 'open', 'about', 'this', 'and', 'i', 'admire', 'her', 'openness', 'to', 'this', 'situation', ',', 'my', 'buying', 'a', 'new', 'phone', 'has', 'now', 'become', 'secondary', 'and', 'all', 'credit', 'to', 'her', 'she', 'held', 'my', 'hand', 'in', 'all', 'the', 'details', '.', 'we', 'made', 'contact', 'with', 'the', 'billing', 'department', 'of', 'vodafone', 'in', 'an', 'attempt', 'to', 'put', 'things', 'right', ',', 'i', 'still', 'have', 'beef', 'to', 'resolve', 'with', 'the', 'billing', 'department', 'at', 'vodafone', ',', 'but', 'joleen', 'of', 'ashford', 'kent', 'your', 'a', 'star', '.']","{'neg': 0.0, 'neu': 0.903, 'pos': 0.097, 'compound': 0.8338}"
"We were served by Jack, who was very helpful and attentive, polite and professional.","['we', 'were', 'served', 'by', 'jack', ',', 'who', 'was', 'very', 'helpful', 'and', 'attentive', ',', 'polite', 'and', 'professional', '.']","{'neg': 0.0, 'neu': 0.808, 'pos': 0.192, 'compound': 0.4754}"
"The staff in this shop are brilliant, in spite of the company trying to fail me, because of the staff I persevered with Vodafone","['the', 'staff', 'in', 'this', 'shop', 'are', 'brilliant', ',', 'in', 'spite', 'of', 'the', 'company', 'trying', 'to', 'fail', 'me', ',', 'because', 'of', 'the', 'staff', 'i', 'persevered', 'with', 'vodafone']","{'neg': 0.225, 'neu': 0.651, 'pos': 0.124, 'compound': -0.4767}"
Cedric was very helpful and helped me sort out my discount for my phone upgrade,"['cedric', 'was', 'very', 'helpful', 'and', 'helped', 'me', 'sort', 'out', 'my', 'discount', 'for', 'my', 'phone', 'upgrade']","{'neg': 0.0, 'neu': 0.819, 'pos': 0.181, 'compound': 0.4754}"
